,,Notes,Aisa Minh,Masao Sy,Leta Narvaez,Victoria Swift,Solomon Renfield,Justyn Attlee,Grizzly Saeki,Akemi Kobayashi,Sassoon,Ezel Sinai,Arvin Sanjrani,Knox Mandaba
,Bldg_Resisted,"Building resists damage, currently anyone can comment but I can change this to _Obs/_Self/_Vek if we think it's worth it.","""Building w- no, it's standing!"", ""That building held, somehow... Start moving!"", ""Take that enemy down before it tries again!""","""Keep going. The building held, but we shouldn't have had to test it."", ""They're alive.. They're alive!"", ""The building held. Move, move!""","""Building held, hostile couldn't take it down!"", ""Civilians are safe, don't let it get hit again!"", ""We got lucky, the building's unscathed."", ""That building took the hit, get rid of that hostile!""","""This building's designer deserves distinction for the lives saved."", ""A failure on our part, but an astounding success for the engineers of this building."", ""Our luck won't hold next time. Move that enemy away."",","""The workers who made that building have done a commendable job."", ""The Grid.. is intact. An unexpected, but welcome turn of events."", ""We came very close, but it appears the building has held!"", ""Despite that blow, our Grid is fully intact!""","""I can't believe it.. The building held!"", ""The building is still standing.. Somehow.."", ""H-how? It's intact!"", ""Our Grid didn't take any damage!""","""Building shouldn't have been hit in the first place."",""Not opportune. That building shouldn't have been threatened."",""Our tactical blunder was forgiven this time."",""A mistake unpunished, for now.""","""Our ineptitudes have passed harmlessly, this time."",""We cannot allow our shortcomings to put our resources at risk again."",""Quick, eliminate the hostile before it can try again."",""Get moving before our luck gives out!""","""I can't believe it.. The building held!"", ""The building is still standing.. Somehow.."", ""H-how? The.. The building is intact!"", ""Our Grid didn't take any damage!""","""A stroke of luck in a terrible situation."",""Opportune, but don't take that as license to slip up again."",""Don't let this become a trend. Stop the Vek from threatening us in the first place.""","""..No casualties. We got out lucky."",""Not an ideal test of the building's strength, but.. it held."",""Incredible, to see the building withstand such a blow.""","""Watch out, that Vek.. Oh, we got lucky!"",""Hey, get moving so that building stays safe!"",""Couldn't have gone any better!"",""I can't believe that building actually held.."""
,,,,,,,,,,,,,,
,,,,,,,,,,,,,,
Mission Specific,Mission_Train_TrainStopped,,"""The train was damaged. It'll be out of commission, but we can probably salvage it."", ""My scans tell me the train's been wrecked.. but not destroyed.""","""The train's motor unit just gave out. Keep the rest of it safe."", ""#corp's not gonna be happy if we lose the rest.""","""The train's been damaged, it's not going anywhere."", ""Train took heavy damage, it needs repairs."", ""The train's not gonna make it in time, but it's still alive."", ""#corp's gonna have to repair the train now.""","""The train has been derailed. The resources to fix it will cost #corp far too much."", ""#corp can fix the train, but it won't make the route on time."",","""That train will be expensive to repair, but we can get it operational."", ""The repairs necessary for that train will delay its arrival.."",","""The train was destroyed. Or, maybe we can repair it."",""The train's been badly damaged. If we protect it, we may be able to get it operational again.""","""Train's movement completely compromised."",""The cargo may still be intact if we're lucky."",""Keep the Vek from destroying the remnants.""","""Our logistics will be a nightmare without this supply line up."",""As outdated as this train was, it was still vital. Now it's a wreck."",""#corp will have to find some other way to carry the supplies, because of us.""","""The train was destroyed. Or, maybe we can repair it."",""The train's been badly damaged. If we protect it, we may be able to get it operational again.""","""Train's derailed, it'll take a full operation to get it running again."",""I'm afraid the train won't leave the region in this state."",""#corp will have to wait a little longer for those supplies.""","""#corp won't be pleased if we let the train take any more damage."",""Train's not going anywhere in this state."",""We'd better hope the supplies made it.""","""Don't worry, we can repair it. Well, worry at least a little."",""These are pretty expensive to repair.."",""We'd better hope the crew survived that."""
,Mission_Train_TrainDestroyed,,"""The train's been obliterated now. Looks like it's lost."", ""The train's heat signature just went.. Looks like the crew's gone.""","""The train is gone now. We've failed them."", ""We just lost the train.. How many crew members were there?"",","""We're not getting the train back now."", ""The train's definitely gone. We should have been quicker."",","""We can't salvage the train at this point."", ""The train is just rubble now. I don't anticipate they'll be able to replace this line soon."",","""The skeleton could be re utilized, but otherwise it's all but destroyed."", ""The train is beyond repair now. We could get some spare parts from it, maybe."",","""The train's definitely done for now."",""Train was already in bad shape, now it's barely recognizable.","""Train's completely lost."",""Not worth repairing the train at this point."",""The train and its crew were wiped out."",""Nothing remains of the train.""","""There won't be a single car left to salvage."",""Even the railway is unusable now."",""We've failed to protect the train, at all.""","""The train's definitely done for now."",""Train was already in bad shape, now it's barely recognizable.","""Even the line's been destroyed.."",""I doubt there'll be anything left to salvage, let alone rescue."",""The next region will be crippled by the loss of their supply line.""","""So many lives lost, the train couldn't just stay at station."",""Not a building full of civilians, but it's still a bad loss.""","""I've operated one of these before, sad to see this one go."",""I don't think the crew made it out either."",""Not too optimistic about finding any survivors."""
*,Mission_Block_Reminder,Remind player to block emerging Vek,"""I'm still feeling tremors. We need to continue blocking the Vek."", ""Try and pin down the Vek with themselves, but if you need to just use your own mech."",""Our objective is to keep those Vek in the ground, get into position!""","""We need to block these Vek, act with haste."", ""Pin down the Vek with your mechs, they need to stay down there.""","""Our orders are to keep those Vek in the ground, get moving!"", ""We still need to pin down more Vek."", ""Use your mechs to block those Vek if you have to!""","""Primary objective is to keep the Vek in the ground, #squad."", ""Focus on your objective, pilots - Block those Vek from emerging!"",","""We need to focus on keeping the Vek below the ground."",""Keep the Vek in the ground, we have our orders!""","""Orders say we need to keep the Vek under the surface."", ""Keep those Vek from surfacing, so we can deal with them with other means!"",""Stop the Vek from surfacing, with whatever means necessary!""","""Keep to the objective, prevent the Vek from surfacing."",""The Vek need to stay underground."",""Keep those Vek underground by any means necessary.""","""We need these Vek in the ground to secure the region."",""Keep those Vek underneath, it'll make things a lot easier moving forward."",""Prevent the Vek from emerging, so #corp can take them out for us.""","""Orders say we need to keep the Vek under the surface."", ""Keep those Vek from surfacing, so we can deal with them with other means!"",""Stop the Vek from surfacing, with whatever means necessary!""","""Keep these Vek slumbering underneath."",""Let #corp deal with these Vek. We just need to keep them down there."",""Remember, we need to prevent any more Vek from surfacing.""","""It's important for #corp that we keep these Vek underneath."",""Make sure these Vek don't surface, we need them in the ground."",""Don't let the remaining Vek surface, we need more down there.""","""We need those Vek trapped underneath!"",""We've still got more Vek to contain."",""Remember, keep these Vek in the ground!"""
Archive Inc,,,,,,,,,,,,,,
,Mission_Airstrike_Incoming,,"""Tremors.. Archive bomber's making a fly-by."", ""Getting comms from the Archive bomber, stay clear of its flight path!."", ""Get out of the Archive bomber's path, it's doing a fly-by!"",","""Archive bomber coming in, let's help it out."", ""Archive bomber's coming in for a strafing run."", ""Archive bomber's flying over, stay clear."",","""Archive bomber is doing a fly-by, stay out of the strike area."", ""Air strike arriving!"", ""Those pilots better watch where they drop those bombs.""","""Bomber coming in... Just like old times."", ""This rookie has a thing or two to learn about flying planes."",","""That Old Earth bomber is.. ancient. And yet, somehow."", ""Air strike headed our way. Antiquated, but still deadly!""","""Old Earth bomber incoming, I'd better back off."", ""Stay away from the Old Earth bomber, it's dropping a heavy payload!"",","""That pilot needs a bit more training.."", ""Stay clear, air support incoming."",""Those bombs are powerful, stay clear.""","""I think I need to have a word with that pilot."",""Bomber's on another flyby through our region, avoid the carpet bomb."",""Stand clear of the bomber's trajectory or suffer the consequences.""","""Old Earth bomber incoming, I'd better back off."", ""Stay away from the Old Earth bomber, it's dropping a heavy payload!"",","""Been a while since I've seen a plane like that. Stay clear."",""Watch your sensors, bomber's doing a flyby."",""Make sure you're not in the Old Earth bomber's flight path, whatever the cost.""","""See if you can place any Vek in that Archive bomber's flight path."",""Try not to get in the bomber's way, it's making another pass."",""Watch yourselves, Old Earth bomber's coming through.""","""Hey, I recognize that pilot! Stay out of her way and she'll hit her mark."",""Better hope that rookie doesn't blow us all to hell."",""Watch your position, let the bomber do the work for us."""
,Mission_Tanks_Activated,Both tanks survived to activation,"""Archive's Old Earth tanks are up and running!"", ""Signals received from the Old Earth tanks, they're operational!"",","""The Old Earth tanks are up, let's take the offensive!"", ""Archive tanks are functional, let's put them to good use."",","""The Old Earth tanks are up and running. I bet they'll be useful."", ""Looks like we won't have to babysit the Old Earth tanks anymore."", ""Archive tanks calling in, looks like they're ready to fight.""","""Tanks are sending communications, they're ready to engage."", ""Use these tanks well - What they lack in firepower, they make up for in utility."",""The tanks are functioning, and ready for battle.""","""A testament to our desperation, craftsmanship and ingenuity all at once to have these tanks running!"", ""Archive has managed to get these old tanks functioning once more. Incredible.""","""Good, the Old Earth tanks are operational. We should be able to fight the Vek off now!"", ""The Old Earth tanks are up. No matter how small, more firepower is welcome!""","""Old Earth tanks are functional."",""Dated machinery, but still useful."",""Now that they're up, these tanks are surprisingly fast.""","""Didn't expect these tanks to ever get working, but I suppose I shouldn't ever doubt Alms."",""We've even got these old hunks up. Color me surprised."",""The capabilities of Old Earth equipment on the field never ceases to surprise me.""","""Good, the tanks are operational. We should be able to fight the Vek off now!"", ""The Old Earth tanks are up. No matter how small, more firepower is welcome!""","""Looks like the Old Earth tanks have finally decided they want to fight back."",""Color me impressed, they got both the Old Earth machines functional.""","""Both Old Earth tanks are operational, good work!"",""Both of the old machines are up, Alms should be pleased."",""Incredible that they managed to get both of those things running.""","""Both tanks are running. They're more useful than they look, trust me!"",""Time for these tanks to get to work."",""Alms didn't have any pilots to spare, but these tanks should still be useful."""
,Mission_Tanks_PartialActivated,Only one tank survived to activation,"""Getting signatures from the Old Earth tank, I think it's ready to join."", ""Registering signals from the Old Earth tank. Looks like it's ready."",","""The other Archive tank just got operational, don't let it fall too."", ""Old Earth tank up. We've got you covered this time.."",","""We lost one Old Earth tank, but the other one's up and running now."", ""The surviving Old Earth tank is up, don't let this one get destroyed.""","""The surviving tank is operational. Make sure it remains intact."", ""'The remaining tank is ready for action, protect it well."",","""The remaining Old Earth tank is operational! Keep it going until we can route the Vek."", ""I can see why these tank designs were antiquated..""","""The last Old Earth tank is operational.. but it would have been better to have both."", ""At least we've got one Old Earth tank left, up and ready.""","""Just one Old Earth tank. It'll do."",""Couldn't save both tanks, but one is fine."",""Tank's operational, ensure it stays that way.","""We didn't manage to get both tanks operational, but this will do."",""Better one tank than none. Keep it that way, yes?"",""I'm expecting that the remaining tank will be up when the battle closes.""","""The last tank is operational.. but it would have been better to have both up."", ""At least we've got one tank left, up and ready.""","""Keep the last Old Earth tank operational."",""Don't allow any Vek to attack the last Old Earth tank.""","""The remaining Old Earth tank is finally up and running."",""We've got the last Old Earth tank with us now, keep it safe."",""Ensure the last Old Earth tank remains operational.""","""Better we have at least one tank up."",""Shame to see the other tank go, but this one'll still do us proud."",""At least make sure this tank makes it through."""
*,Mission_Dam_Reminder,Remind player to destroy the Dam,"""Prioritize taking the dam down. When we destroy it, it'll do a lot of the work for us."", ""Focus your fire on that dam, let it do the hard work.""","""I feel like the dam could be better used, but orders are orders."", ""We need to bring that dam down, focus.""","""Can't think of a better use than to drown some Vek."", ""Lock your weapons onto that dam, we need to bring it down!""","""Fire at the dam when the opportunity presents itself. The river will provide a critical strategic advantage."", ""The river that dam is blocking will provide an impenetrable barrier. Make sure it comes down.""","""If it were up to me, I'd put that dam to good use. But we have our orders to destroy it."", ""It's a miracle Old Earth got that dam functioning, but I'm afraid we'll have to take it down."", ""Surely we could release that dam manually.. I hope you're not wasting it, Dewey."",","""If we take that dam down, it means ground Vek won't be able to attack the buildings up close anymore."", ""Prioritize that dam, take it down and it'll do the work for us!""","""Take down that dam, it'll make this operation easier."",""Destroy the dam so we can drown these Vek."",""Focus on the dam. We'll put it to better use.""","""We never managed to get power from the dam. Break it down and put it to use."",""We'll deal with the impact on our terrain afterwards, just destroy the dam.""","""If we take that dam down, it means ground Vek won't be able to attack the buildings up close anymore."", ""Prioritize that dam, take it down and it'll put work in for us!""","""If you see an opening, open fire on the dam!"",""We need to prioritize the dam, it'll make this region easier to secure.""","""That dam needs to come down, it's been blocking the river for ages."",""The amount of water that dam is holding back will do us wonders.""","""Focus fire on that dam, it needs to go!"",""That dam's older than all of us combined, it's about time we tore it down."",""Hey, remember we need to shoot that dam to bits."""
,Mission_Dam_Destroyed,After the completed animation of the dam drowning things,"""W-woah... Yep, the dam just went down."", ""My readings are spiking, we've finished off the dam!""","""I suppose if they weren't using it.."", ""I hope Archive know what they're doing with this river.""","""That river should block the Vek, this was a pretty good decision."", ""Dam went down, hold your ground!""","""Looks like our calculations were accurate - the river has worked perfectly."", ""The river's been released, according to plan. Excellent."",","""The torrent of water that dam, or the lack thereof, has created.."", ""Impressive work. Kern would love to form rivers this quickly."",","""That's a surprisingly deep river. It should wash the Vek away with ease!"", ""About time I bathed my mech off, it's covered in Vek guts.""","""Excellent. Make use of this river."",""Battle's not over yet, start pushing these Vek in.""","""Dam's destroyed. Make good use of the water."",""This stream will wash any Vek away. Get to work!"",""Great, dam's destroyed. Focus on the Vek!""","""That's a surprisingly deep river. It should wash the Vek away with ease!"", ""Shame I can't bathe my mech off, it's covered in Vek guts.""","""A natural barrier like this will work wonders."",""If we're smart, we can weaponize this while the Vek are still around.""","""We'll find out if Alms knew what he was doing or not later, focus on the Vek."",""Downstream might be a mess, we'll find out soon enough.""","""If you stand in front of the dam it'll wash your mech off for free."",""Let's use this new river to our advantage!"",""This should keep one side safe from the Vek."""
,Mission_Satellite_Destroyed,"Triggers only when the first satellite is destroyed ","""One of the satellites was destroyed."", ""Lost the satellite's heat signature, looks like it's been wrecked.""","""Gah, we lost one of the rockets."", ""We lost a satellite, keep the other one up.""","""We lost one of the satellites, hope Archive's fine with just one."", ""First satellite was lost, we need to keep the second in operation.""","""We've lost a satellite. Such a waste of resources."", ""A critical source of information, lost.""","""A great shame, for the old world, and for us."", ""Perhaps, if we.. no, we cannot salvage the payload nor the rocket.""","""The satellite was compromised. That was probably important..."", ""No way a pile of scrap's gonna make it out of orbit.""","""Launch site is unsalvagable."",""Satellite's FUBAR."",""It's not launching in this state.""","""Maybe we can salvage the launch site, but those resources would have been vital."",""I don't think we'll have this satellite operational any time soon."",""We've failed to protect this satellite. There goes the data.""","""The satellite was compromised. That was probably important..."", ""No way a pile of scrap's gonna make it out of orbit.""","""Our gift to the stars, put to waste."",""Ah, we lost a satellite. Unfortunate.""","""The amount we could have learned from that satellite..."",""An incredible loss, that satellite was. Would have given us so much."",""We've squandered this Old Earth relic. At least we can still secure the region.""","""We lost one of the satellites, hope Archive's fine with just one."", ""First satellite was lost, we need to keep the second in operation."""
,Mission_Satellite_Imminent,"Triggers when the Satellite queues its launch (the turn before it actually launches) -- It can trigger for either satellite, or both, it's randomized.","""That satellite's heating up. I think it's about to take off."", ""Judging by my scans, the satellite should be off the ground soon."",","""Hold the line, the satellite is almost off."", ""Watch out, the satellite is nearly off the ground."",","""Satellite's primed for launch, distance yourselves."", ""If you stand next to that satellite, it'll vaporize you. Stand clear!"",","""Stay away from the launch pad, or your mech will be irreparably damaged."", ""Staying next to the satellite during launch will be fatal.""","""Protect the rocket, but keep your distance. It's about to launch!"", ""The rocket is readying for launch!"",","""We need to buy that satellite just a little more time."", ""Take off, already. We can't hold back the Vek forever!"", ""Stay back from the rocket, don't let the blast hit you.""","""Stay clear, your mech won't withstand the blast."",""We can use the satellite's launch to our advantage."",""Our query is about to take off.""","""Avoid the satellite's launch radius."",""Now that the satellite's taking off, let's see if we can put it to use against the Vek.""","""We need to buy that satellite just a little more time."", ""Take off, already. We can't hold back the Vek forever!"", ""Stay back from the rocket, don't let the blast hit you.""","""Think we could steer a Vek towards that satellite?"",""One of the satellites is initiating take-off, pay attention.""","""The heat that satellite's giving off would fry anything in the way."",""I believe that satellite's about to lift off. Stand clear.""","""Standing next to a launch site isn't fun, trust me on that one."",""Hey, let's try and get the Vek front row seats, shall we?"",""I think the Vek would like to see the launch a little more clearly!"""
,Mission_Satellite_Launch,"Triggers when the satellite actually takes off, can trigger for either or both","""Those were some intense vibrations. Hope it took off successfully."", ""I think I just heard the satellite take off. Definitely not something you get to say every day."",","""Satellite's off. We can rest a little."", ""There goes a satellite. Amazing work, Archive."",","""Sensors are telling me the launch was successful."", ""Good, that satellite will be in orbit soon.""","""The team on that rocket did better than I thought."", ""Excellent, that satellite will provide critical data.""","""Perhaps some day, I'll be able to test the impact of low gravity on temporal manipulations."", ""A miracle they've managed to restore the rocket, and one I'm ecstatic to see.""","""Right into orbit.. I wish I could eject all my problems into space too."", ""Up in the air, and out of the world. Somewhere it doesn't have to worry about Vek.""","""I'm sure Archive will put it to good use."",""We should take any resource we can get."",""The data that provides will very valuable."",""Satellite took off.""","""Let's see if it really was as useful as Alms thought it'd be."",""Up in space, at least we won't have to worry about protecting it."",""Not my kind of rocket, but it'll still come in handy.""","""Right into orbit.. I wish I could eject all my problems into space too."", ""Up in the air, and out of the world. Somewhere it doesn't have to worry about Vek.""","""I can't imagine how much data that satellite will be providing #corp."",""We'd better hope they share the results, that machinery is incredible.""","""For a corporation that works on old things, they never cease to amaze me."",""I'll have to request the data from Alms myself.""","""Used to dream of going to space. Guess this is as close as I'll get."",""Up and away!"",""Maybe if we make it through this mess I'll live to service one of these."""
,Mission_Mines_Vek,Vek Killed by Mine,"""That was quite an explosion. Did a Vek step on a mine?"", ""Vek just vanished on a mine's position. Nice.""","""A mine blew up a Vek, my praises to whoever laid that."", ""Vek just died to a mine, watch your footing.""","""Vek just blew up on a mine."", ""Ha, guess your hormones can't tell you what those are."", ""Vek just stepped on a mine, let's keep them coming!""","""Old-fashioned mines. Barbaric, a fitting measure against the Vek."", ""Vek was blown apart by a proximity mine."",","""A tremendous explosion. I wonder what purpose Old Earth had for mines this lethal."", ""Surely Old Earth didn't have foes that required mines this large.."",","""One wrong step, and that Vek was just obliterated."", ""I couldn't be more thankful we can recognize landmines and the Vek can't."", ""Keep coming, Vek, the more mines you step on the less work we have to do.""","""Mine just wiped out that Vek."",""One less mine for us to utilize."",""Feel free to position yourselves there now.""","""Don't ask what we were keeping these around for."",""Large hole where the Vek once was. These mines never disappoint.""","""One wrong step, and that Vek was just obliterated."", ""I couldn't be more thankful we can recognize landmines and the Vek can't."", ""Keep coming, Vek, the more mines you step on the less work we have to do.""","""Torn to bits by the savagery of the Old Earth."",""Nothing short of amazing, what those mines can do.""","""Don't end up like that Vek, watch your step."",""Let's see if we can clear out the rest of these Vek with those mines.""","""Tripping on one of those is really expensive.. and also deadly, yeah."",""Well, we had to use them for something."",""Better under a Vek than collecting dust in a warehouse."""
,,,,,,,,,,,,,,
RST,,,,,,,,,,,,,,
